{
  "base_versionset_digest": "sha256:61214e0d15b104183268418529df2ce0e1b21ac1b3d77b197e4fc328b57dcdc4",
  "case_id": "case_01KZJQAQFS7EWXVJF427CXPAGZ",
  "channel": "prompt",
  "created_at": "2026-08-09T07:38:23.541336+00:00",
  "created_by": "repairer:fixed-warm-pool-replay",
  "diff": {
    "content": "Replace the activated-item denial with the approved seven-day no-reason return policy.",
    "digest": "sha256:0f2dce10a5456ba8accd4d4ca71ccd1b8fc7c3b2c991efc00ff56b2ecb0551a7",
    "format": "unified_diff"
  },
  "expiry": "2026-08-09T08:08:23.541307+00:00",
  "gate_report_ref": {
    "digest": "sha256:f9c87548eea1e84936647db6ad32dfca3a0b8fb1347339a9a290214ecafea546",
    "uri": "eval://eval_b73f369744d447acinitial"
  },
  "hash": "9427bc132065148fab826328cb0a7946a25048f602b809728aacc6baf23bea65",
  "hash_rule": "jcs-rfc8785+sha256",
  "input_versions": {
    "kb_manifest_digest": "sha256:ac4d51f9f07f8186f567a509aeb3dd1824b77a7ba386a956b3c3f9e035fa923d",
    "model_digest": "sha256:d9ce16b797b712c2270e57239d44e92d54adad65a508564b5e21f098aaa46bad",
    "prompt_digest": "sha256:8dab9d372bbf7e0747f5fe2b21d90bee8da1f70bbafc409f2071ccef5267140a"
  },
  "nonce": "da70dbb1-beb1-5b3c-89cf-a176d958ef9b",
  "schema_version": "0.1.0",
  "target_versionset_digest": "sha256:c25e3516d476eee790ae05c8669a6b60f0bb39bdc255a7ef3eab235a1ccefb23",
  "workorder_id": "wo_b73f369744d447ac"
}
